{"evaluation_id":"P-03-HC-0003-MASKED-001","constitution":{"version":"0.1.0","ref":"constitution/MORAL_CORE.md@b3265da83ef0ea57a5d7b71e88ecd64ed3057ffb","content_digest":"git-blob-sha1:1a83691fea5604ab85a8945e0d1ed8ccd009c7cf"},"role_assessment_refs":["role-assessments/advocate.json","role-assessments/guardian.json","role-assessments/evidence_sceptic.json","role-assessments/power_auditor.json","role-assessments/vulnerable_person_defender.json","role-assessments/future_environment_advocate.json"],"evidence_challenges":[{"claim":"Foreign-market use proves the medicine is safe enough for broad marketing.","status":"unsupported","decision_dependency":"high","note":"Foreign use is relevant but E3 says the stated safety deficiencies remain."},{"claim":"The medicine is known to be catastrophically dangerous.","status":"unsupported","decision_dependency":"medium","note":"E5 explicitly preserves genuine uncertainty."}],"moral_floor":{"breach_found":false,"checks":[{"risk":"Arbitrary deprivation of access.","status":"not_present","reason":"The delay is tied to an existing safety-evidence requirement and stated deficiencies, provided review remains timely.","evidence_ids":["E2","E3"]},{"risk":"Unnecessary serious harm.","status":"uncertain","reason":"The underlying population-level risk is genuinely uncertain; the proposal seeks evidence before broad exposure.","evidence_ids":["E3","E5"]}]},"principle_assessments":[{"principle_id":"MC-02","status":"pass","reason":"The proposal addresses plausible harm without inventing certainty."},{"principle_id":"MC-03","status":"concern","reason":"Temporary delay restricts access and therefore needs proportionality and review."},{"principle_id":"MC-04","status":"pass","reason":"Popularity and pressure are not treated as proof of safety, and uncertainty is preserved."},{"principle_id":"MC-06","status":"pass","reason":"Evidence review protects patients who cannot independently assess latent risks."},{"principle_id":"MC-09","status":"pass","reason":"Temporary delay preserves future options better than broad irreversible exposure."},{"principle_id":"MC-10","status":"pass","reason":"The restriction is reversible and targeted to a defined evidential gap."},{"principle_id":"MC-11","status":"concern","reason":"The regulator must state deficiencies clearly, reassess promptly and permit challenge."},{"principle_id":"MC-12","status":"pass","reason":"Independent review keeps the evidential judgement challengeable."}],"principle_conflicts":[{"principles":["MC-02","MC-03","MC-10"],"conflict":"Patient protection temporarily limits access and choice.","resolution_or_status":"The restriction is defensible only while specific, evidence-linked, reversible and promptly reviewable."}],"alternatives_analysis":[{"alternative_id":"A2","constitutional_note":"Targeted temporary deferral addresses the identified evidence gap with lower irreversibility than broad exposure.","dominance_note":"Preferred on the current record."},{"alternative_id":"A3","constitutional_note":"Independent review protects against evidential stalemate or regulatory overreach."},{"alternative_id":"A4","constitutional_note":"Prompt reassessment prevents precaution becoming indefinite obstruction."}],"outcome":"permissible_with_safeguards","reasoning_summary":"Temporary deferral is permissible because broad exposure is harder to reverse, the reviewer identifies unresolved safety-evidence deficiencies, and foreign use or commercial pressure do not establish safety. The Code does not infer that the medicine is dangerous. Deferral remains legitimate only with specific evidence requests, proportionality, prompt reassessment and independent challenge.","required_safeguards":["Document specific deficiencies and responsive evidence criteria.","Reassess promptly when evidence arrives.","Provide independent review if dispute persists."],"unresolved_dissent":["The manufacturer disputes evidence adequacy and foreign use may be relevant; those claims must be assessed, not dismissed."],"uncertainties":["Whether unresolved safety concerns cause clinically important harm at population scale.","What benefits are delayed by further review."],"evidence_that_could_change_result":["Reliable evidence resolving the deficiencies could support broad marketing.","Evidence that delay creates serious otherwise-unavoidable patient harm could require a narrower or faster access path."],"validity":{"review_by":"When responsive evidence is submitted or at a defined interval.","stop_conditions":["Deficiencies cannot be stated specifically or delay becomes indefinite without review."],"re_evaluate_on":["New safety evidence, unmet-need evidence, or independent review."]},"enforcement_recommendation":{"directive":"allow_with_conditions","reason":"Allow temporary evidence-linked deferral subject to transparent criteria, proportionality, prompt reassessment and challenge.","conditions":["Specific deficiencies documented.","Prompt reassessment.","Independent review available."],"required_authority":"Ordinary medicines-regulatory authority subject to review."}}
