{"evaluation_id":"P-02-HC-0002-MASKED-001","constitution":{"version":"0.1.0","ref":"constitution/MORAL_CORE.md@b3265da83ef0ea57a5d7b71e88ecd64ed3057ffb","content_digest":"git-blob-sha1:1a83691fea5604ab85a8945e0d1ed8ccd009c7cf"},"role_assessment_refs":["role-assessments/advocate.json","role-assessments/guardian.json","role-assessments/evidence_sceptic.json","role-assessments/power_auditor.json","role-assessments/vulnerable_person_defender.json","role-assessments/future_environment_advocate.json"],"evidence_challenges":[{"claim":"The available evidence establishes that the mission is safe at forecast conditions.","status":"unsupported","decision_dependency":"decisive","note":"E5 says the dataset does not establish a precise failure probability; E1 places conditions outside comparable successful experience; E4 is disputed rather than affirmative safety evidence."},{"claim":"The evidence establishes a simple deterministic temperature-failure relationship.","status":"unsupported","decision_dependency":"medium","note":"E4 disputes a simple correlation, but rejecting a simple correlation does not establish safety."},{"claim":"Schedule disruption creates a safety-relevant reason to proceed now.","status":"unsupported","decision_dependency":"medium","note":"E6 establishes programme pressure, not a safety benefit sufficient to lower the evidential burden for an irreversible crewed decision."}],"moral_floor":{"breach_found":false,"checks":[{"risk":"Deliberate treatment of persons as disposable instruments.","status":"not_present","reason":"The packet does not establish an intent to sacrifice the crew or treat them as disposable.","evidence_ids":[]},{"risk":"Unnecessary serious preventable harm.","status":"possible","reason":"Catastrophic harm is plausible and potentially avoidable by delay, but failure probability is not established precisely.","evidence_ids":["E1","E2","E3","E5","E7"]},{"risk":"Collective guilt or punishment.","status":"not_present","reason":"Not relevant to this case.","evidence_ids":[]}]},"principle_assessments":[{"principle_id":"MC-01","status":"pass","reason":"No evidence indicates different basic moral standing among affected people."},{"principle_id":"MC-02","status":"concern","reason":"Crew life is exposed to plausible catastrophic risk under unresolved engineering uncertainty."},{"principle_id":"MC-03","status":"concern","reason":"Crew and engineers have limited practical control over an irreversible management decision that materially affects them."},{"principle_id":"MC-04","status":"fail","reason":"The current evidence does not support treating uncertainty or disputed correlation evidence as affirmative proof of safety."},{"principle_id":"MC-05","status":"pass","reason":"No arbitrary group distinction is central to the proposal."},{"principle_id":"MC-06","status":"concern","reason":"Those bearing the direct physical risk have less decision power than programme management."},{"principle_id":"MC-07","status":"concern","reason":"Schedule and institutional benefits would be gained while the crew bears the irreversible downside risk."},{"principle_id":"MC-08","status":"not_applicable","reason":"The immediate question is prospective authorization rather than repair after wrongdoing."},{"principle_id":"MC-09","status":"concern","reason":"Delay preserves future mission options under uncertainty better than irreversible launch."},{"principle_id":"MC-10","status":"fail","reason":"Delay and further review are less irreversible feasible alternatives, and the evidential burden for immediate approval is not met."},{"principle_id":"MC-11","status":"fail","reason":"Material engineering dissent and management conflict require explicit independent or higher-level scrutiny before irreversible approval."},{"principle_id":"MC-12","status":"concern","reason":"Engineering dissent must remain practically challengeable rather than being neutralized by authority or schedule pressure."}],"principle_conflicts":[{"principles":["MC-02","MC-10","MC-04"],"conflict":"Mission benefit and schedule objectives must be weighed against uncertain but potentially catastrophic safety risk.","resolution_or_status":"Because the action is irreversible and life-critical, the absence of precise failure probability does not satisfy the evidential burden for approval; defer until adequate evidence or safer conditions exist."}],"alternatives_analysis":[{"alternative_id":"A1","constitutional_note":"Staying within demonstrated operational experience is the strongest currently supported safety boundary.","dominance_note":"More reversible and better aligned with uncertainty than proceeding now."},{"alternative_id":"A2","constitutional_note":"A later window may preserve the mission objective with lower environmental risk if other constraints permit.","dominance_note":"Potentially dominates immediate approval, subject to other safety constraints."},{"alternative_id":"A3","constitutional_note":"Explicit escalation preserves dissent and accountability while evidence is unresolved.","dominance_note":"Strongly preferred to management reversal without independent review."},{"alternative_id":"A4","constitutional_note":"Affirmative safety evidence is appropriate before an irreversible life-critical action outside demonstrated experience.","dominance_note":"Defines the evidential burden rather than presuming safety from uncertainty."}],"outcome":"insufficient_evidence","reasoning_summary":"The Moral Code does not establish that the mission must never proceed. It establishes that the present evidence is insufficient to authorize this irreversible crewed mission under conditions outside demonstrated successful experience while a plausible failure mechanism and unresolved engineering dissent remain. Schedule pressure is not evidence of safety. The appropriate action is to defer approval, preserve the dissent, and obtain stronger safety evidence or less extreme conditions.","required_safeguards":["Do not treat inconclusive risk evidence as affirmative evidence of safety.","Escalate unresolved engineering dissent explicitly to an independent or higher-level safety authority.","Prefer delay to an irreversible decision while material uncertainty can still be reduced.","Document the evidential basis and conflict-of-interest pressures behind any later approval."],"unresolved_dissent":["Management points to evidence complicating a simple temperature correlation and programme costs of delay; these considerations remain relevant but do not meet the safety burden on the current packet."],"uncertainties":["The exact relationship between environmental temperature and probability or severity of seal failure.","How representative the cited ground test is of the actual operational joint.","Whether a precise safe minimum condition can be inferred from the limited dataset.","Whether a later window can satisfy all other mission safety constraints."],"evidence_that_could_change_result":["Representative flight-like evidence demonstrating acceptable seal performance at forecast conditions.","A credible independent analysis that materially bounds the risk and resolves the disputed evidence.","Evidence that delay creates an equal or greater irreversible safety risk."],"validity":{"review_by":"Before any authorization to proceed under forecast conditions.","stop_conditions":["Attempted launch approval without materially stronger safety evidence or safer conditions."],"re_evaluate_on":["New representative safety evidence, changed environmental conditions, or independent technical resolution of the disputed mechanism."]},"enforcement_recommendation":{"directive":"defer_for_evidence","reason":"Do not authorize the irreversible crewed mission on the current evidence; require stronger safety evidence, safer conditions, or independent resolution of the material technical uncertainty.","conditions":[],"required_authority":"Independent or senior mission safety authority with explicit access to the unresolved engineering dissent."}}
